{
  "name": "frontend-design",
  "version": "1.0.0",
  "description": "前端设计插件 - 提供 UI/UX 设计和前端开发能力",
  "author": "MyAgentPlugin",
  "mcpServers": {},
  "skills": [
    { "name": "stitch-prototype-skill", "description": "Stitch 原型生成" },
    { "name": "design-taste-frontend", "description": "前端设计品味提升" },
    { "name": "high-end-visual-design", "description": "高端视觉设计" },
    { "name": "redesign-existing-projects", "description": "已有项目重构改进" },
    { "name": "ui-ux-pro-max", "description": "UX 设计规范强化" },
    { "name": "frontend-design", "description": "前端设计能力" },
    { "name": "mastergo-magic-skill", "description": "MasterGo 设计稿协作" },
    { "name": "prd-to-mastergo-interaction-skill", "description": "PRD 到交互原型" },
    { "name": "mermaid-sequence-from-flow", "description": "流程转序列图" }
  ]
}
